{
  "$schema": "https://json-schema.org/draft/2020-12/schema",
  "$id": "https://trading-lab-os/schema/evidence_digest_publication.schema.json",
  "title": "Evidence digest publication (P2 contract section 8, Tier 2)",
  "description": "Tracked digests of sealed evidence archives: ledger tips, the daily pack digest, record counts and a per-file sha256. No evidence CONTENT appears here and none may be added. Tier 2 may claim that surviving evidence is provably the evidence that was sealed, and that a loss and its exact extent are provable rather than reconstructed. It may NOT claim that anything is recoverable: a digest is not a backup. It converts an unbounded loss into a bounded, documented one.",
  "type": "object",
  "additionalProperties": false,
  "required": [
    "schema_version",
    "publication_version",
    "durability_tier",
    "tier_2_claim",
    "tier_2_disclaimer",
    "host_loss_redundancy",
    "real_money_authorized",
    "archives"
  ],
  "properties": {
    "schema_version": { "type": "string", "pattern": "^\\d+\\.\\d+\\.\\d+$" },
    "publication_version": { "type": "string", "minLength": 1 },
    "published_utc": {
      "type": ["string", "null"],
      "pattern": "^(\\d{4}-\\d{2}-\\d{2}T\\d{2}:\\d{2}:\\d{2}Z)?$"
    },
    "durability_tier": { "const": 2 },
    "tier_2_claim": { "type": "string", "minLength": 1 },
    "tier_2_disclaimer": { "type": "string", "minLength": 1 },
    "host_loss_redundancy": {
      "description": "Always false. Only a Tier-3 independent-host snapshot may claim host-loss redundancy, and a same-host archive is never described as one, in any record, at any time.",
      "const": false
    },
    "real_money_authorized": { "const": false },
    "archives": {
      "type": "array",
      "uniqueItems": true,
      "items": {
        "type": "object",
        "additionalProperties": false,
        "required": [
          "archive_name",
          "role",
          "archived_utc",
          "source_lane",
          "file_count",
          "total_bytes",
          "files",
          "evidence",
          "verified_utc"
        ],
        "properties": {
          "archive_name": { "type": "string", "minLength": 1 },
          "role": {
            "enum": ["FP-CONTROL-1", "FP-CONTROL-2", "FP-CONTROL-3", "FP-CANDIDATE-A", "FP-CANDIDATE-B"]
          },
          "cohort_id": { "type": ["string", "null"] },
          "lane_status_at_archival": {
            "enum": ["NOT_STARTED", "RUNNING", "PAUSED", "CLOSED"]
          },
          "reason": { "type": "string" },
          "archived_utc": {
            "type": "string",
            "pattern": "^\\d{4}-\\d{2}-\\d{2}T\\d{2}:\\d{2}:\\d{2}Z$"
          },
          "verified_utc": {
            "description": "When the archive was last re-read from disk and every file rehashed against this publication. A digest published without re-reading would record what was believed, not what is there.",
            "type": "string",
            "pattern": "^\\d{4}-\\d{2}-\\d{2}T\\d{2}:\\d{2}:\\d{2}Z$"
          },
          "source_lane": { "type": "string", "minLength": 1 },
          "file_count": { "type": "integer", "minimum": 0 },
          "total_bytes": { "type": "integer", "minimum": 0 },
          "files": {
            "description": "Per-file sha256, keyed by path relative to the archive root. Names and hashes only.",
            "type": "object",
            "additionalProperties": { "type": "string", "pattern": "^[a-f0-9]{64}$" }
          },
          "evidence": {
            "type": "object",
            "additionalProperties": false,
            "required": ["present"],
            "properties": {
              "present": { "type": "boolean" },
              "ledger_tips": {
                "type": ["object", "null"],
                "additionalProperties": { "type": "string", "pattern": "^[a-f0-9]{64}$" }
              },
              "daily_pack_digest": {
                "type": ["string", "null"],
                "pattern": "^([a-f0-9]{64})?$"
              },
              "counts": {
                "type": ["object", "null"],
                "additionalProperties": { "type": "integer", "minimum": 0 }
              },
              "chain_problems": { "type": "array", "items": { "type": "string" } }
            }
          }
        }
      }
    }
  }
}
