{
  "schema_version": "1.0.0",
  "publication_version": "FP_EVIDENCE_DIGEST_V1",
  "published_utc": "2026-09-21T17:03:41Z",
  "durability_tier": 2,
  "tier_2_claim": "Surviving evidence is provably the evidence that was sealed, and a loss and its exact extent are provable rather than reconstructed.",
  "tier_2_disclaimer": "A digest is not a backup. Nothing here is recoverable from these values; they convert an unbounded loss into a bounded, documented one. Only a Tier-3 independent-host snapshot may claim host-loss redundancy.",
  "host_loss_redundancy": false,
  "real_money_authorized": false,
  "archives": [
    {
      "archive_name": "p1-l0-qualification-4543d4c3",
      "role": "FP-CONTROL-2",
      "cohort_id": null,
      "lane_status_at_archival": "NOT_STARTED",
      "reason": "P1 qualification lane (L0), retained from docs/p1/P1_CLOSURE.md at source commit 4543d4c330ed7a11c442e9b2ef78a23ac12cea40. Archived as S3's first act so the L1 pre-T0 qualification lane is created fresh and empty. Never credited: contract section 4.",
      "archived_utc": "2026-09-16T16:33:24Z",
      "verified_utc": "2026-09-16T16:33:42Z",
      "source_lane": "/home/hamza/projects/trading/trading_lab_os_final/freqtrade/user_data/fp-control-2",
      "file_count": 8,
      "total_bytes": 6355013,
      "files": {
        "evidence/.fp_capture.lock": "38fd4338bd6bba82d8db00eaa01b847392e3a8deb1c65017ac6d4cc3d0af4e62",
        "evidence/capture_runtime.json": "10429e86b0c8386120ea4ee5612db90c50735dec2ca393335e11131fe1b8df7b",
        "evidence/paper_decision_ledger.jsonl": "7f8d092192dd599cb551550c50e1efdd2ce28280f564792bdc76a73774425851",
        "evidence/paper_incident_ledger.jsonl": "900fc8d19586258b381b73a0dc281936cc0239f69cc5b15a2c4865fcdba9d277",
        "evidence/paper_input_ledger.jsonl": "95103326de2b73145be3e28b5e2d6b91b348ad62a323c2e1b78095f9bccf61ea",
        "logs/freqtrade.log": "b01b07c2d0c0b60478e617e110b7f4dab9db69909e4350c5834b7f4928a6e6de",
        "tradesv3.sqlite": "fd6da1f3a86931cb73bb7fabcef5efd9e64f01785a11b7923603ac44a76caaef",
        "x.jsonl": "e3b0c44298fc1c149afbf4c8996fb92427ae41e4649b934ca495991b7852b855"
      },
      "evidence": {
        "present": true,
        "ledger_tips": {
          "decision": "27f95df081f7db226f76267ecbe8def65e4361889cec153230b10d2ff4a2f3b9",
          "incident": "762de6ee71656968228c84cd6d259ff103a49794d01618320200b6b6b4273088",
          "input": "566e86c8bb7f83eb77bb353f8cfa64b2edd07bdeb6073e6e756479dab3b79b97",
          "trade": "0000000000000000000000000000000000000000000000000000000000000000"
        },
        "daily_pack_digest": "fa347aa5d9084777c311cc93f9c29ae04815aea26b22e867422cc5fa1bada1d0",
        "counts": {
          "decision": 1998,
          "incident": 3,
          "input": 1998,
          "trade": 0
        },
        "chain_problems": []
      }
    },
    {
      "archive_name": "l1-attempt-9ba714fd",
      "role": "FP-CONTROL-2",
      "cohort_id": null,
      "lane_status_at_archival": "NOT_STARTED",
      "reason": "First L1 pre-T0 qualification attempt, source commit 9ba714fdc7c456d04d44256ca84bfefcb04ce3f1. Runtime-attached preflight 16/16 PASS and reconciliation 14/14 PASS at that commit, but scripts/seal_pre_t0_qualification.py could not produce a certificate: it built a preflight RuntimeContext with no observability endpoints and no market route, so checks 6, 11 and 14 returned UNPROVEN and blocked. Repairing that tool changes RUNTIME_TREE, so Mq moves and this lane is superseded rather than reused. Contextual: never credited, never deleted.",
      "archived_utc": "2026-09-16T16:41:27Z",
      "verified_utc": "2026-09-16T16:41:27Z",
      "source_lane": "/home/hamza/projects/trading/trading_lab_os_final/freqtrade/user_data/fp-control-2",
      "file_count": 7,
      "total_bytes": 6355217,
      "files": {
        "evidence/.fp_capture.lock": "8090110ff9bbe662d36af122809a1c9569fd736a241702b8ce1b8e92d3f58eeb",
        "evidence/capture_runtime.json": "3030525431cce288a36cc1bdeb036bbcbbcdfa60773765c09e722181cb042afd",
        "evidence/paper_decision_ledger.jsonl": "6ec879e0bae0f95618b8424f39280b3a3bfccfcbd3f46c0b434516c512f8f9a7",
        "evidence/paper_incident_ledger.jsonl": "02af1167f7a63f6d06124b505ebff7ede5b5695c619f3eba88e5e22b9e55b8ba",
        "evidence/paper_input_ledger.jsonl": "4e20e09277c542572a55b5176c86f158cfe7b03d593ba1f924df525e1dc6d3ca",
        "logs/freqtrade.log": "7ca1512a2f480d7f2c37b7d64af4b70ad6a61d97a7cb9d6b81c942932b6ad84b",
        "tradesv3.sqlite": "011f8f447b5386949f6ff29d8dc9cff9d1f3881d4339dc14c20ef6cd37dd9e1d"
      },
      "evidence": {
        "present": true,
        "ledger_tips": {
          "decision": "75d08ce96cb8a307f87dc60e9466666a050eb7333e2b9586f6a04a36b2fb3257",
          "incident": "29c6973e0a5c9ce634ed67363453f651dd31100c757073354abc139712c4f7a6",
          "input": "c93c3c22b134b9ff36ff00b19fef1623c40963631f2928b55c8d7336dbbdaa0b",
          "trade": "0000000000000000000000000000000000000000000000000000000000000000"
        },
        "daily_pack_digest": "8711087b950c2df112975fcdac6f37d30d1aa337d02e4ddf918257633d471e99",
        "counts": {
          "decision": 1998,
          "incident": 3,
          "input": 1998,
          "trade": 0
        },
        "chain_problems": []
      }
    },
    {
      "archive_name": "l1-qualification-af17c3b8",
      "role": "FP-CONTROL-2",
      "cohort_id": null,
      "lane_status_at_archival": "NOT_STARTED",
      "reason": "L1 pre-T0 qualification lane, contract section 13 stage S3, source commit af17c3b80dad535b524e5ffbe40bef0785b3f605 (Mq). Runtime-attached preflight 16/16 PASS, reconciliation 14/14 PASS, certificate 9780df85a8d05b7534d7cc46f9ea0114a325f668a185011edf1a26092211f915 sealed while the lane was live. Every record reads T0_NOT_FROZEN and carries no cohort id. L1 is never credited: contract section 4.",
      "archived_utc": "2026-09-16T17:03:58Z",
      "verified_utc": "2026-09-16T17:04:17Z",
      "source_lane": "/home/hamza/projects/trading/trading_lab_os_final/freqtrade/user_data/fp-control-2",
      "file_count": 7,
      "total_bytes": 6362015,
      "files": {
        "evidence/.fp_capture.lock": "490d1aa1670cae2a0b48528be66e1d88423ab8f50c9b17840c8dfa68bb54e832",
        "evidence/capture_runtime.json": "5300584a9affef5f50f0f32d828c3ae5fe578d0be6e4122a9c1c73a8ec1aaf96",
        "evidence/paper_decision_ledger.jsonl": "78f09c66519baea28aaef84fe5be66f92aa5ffa66c13efe73bf0082682efac4d",
        "evidence/paper_incident_ledger.jsonl": "21c2793e1d8305a24338cf648c91575852b0388f8ab5f1f49615d6b9051b04b1",
        "evidence/paper_input_ledger.jsonl": "07e8d81a7bdd809aa784b45dd5447f050b7036e236009a894daa505dd34d4d54",
        "logs/freqtrade.log": "bc7553e9637c46715f6249f9dd7097ea560888194cb8071c86d81d4f236c52d3",
        "tradesv3.sqlite": "8b605667a65a601935df0f3e4cd32822b9a574e4ac278b4aa541025ef65cea24"
      },
      "evidence": {
        "present": true,
        "ledger_tips": {
          "decision": "70904c288eaaaa89605f5e191a9baf97961ea73cc36f68477ba0020b97db2852",
          "incident": "bfb858e1d22379abfaac3b0bc041e06d77a3dacce699185000c4c581d1ed01c7",
          "input": "26859dfe637a8e9b4f59c89b8544b1adc7c67c37ff486170d5dcbae2f8d1742a",
          "trade": "0000000000000000000000000000000000000000000000000000000000000000"
        },
        "daily_pack_digest": "da31ba3f27c6890a90a98868f0c8387658e33b9ff9894da7e94ae04d15c54f6c",
        "counts": {
          "decision": 2000,
          "incident": 3,
          "input": 2000,
          "trade": 0
        },
        "chain_problems": []
      }
    },
    {
      "archive_name": "l2-prestart-0e920db6",
      "role": "FP-CONTROL-2",
      "cohort_id": "FP-CONTROL-2-20260920T120000Z",
      "lane_status_at_archival": "RUNNING",
      "reason": "First FP-CONTROL-2 runtime start, stopped before T0 and archived without being credited. The runtime was started 43.6 h before the frozen T0 (2026-09-20T12:00:00Z) to avoid an activation gap. Because t0_relation is decided by candle close, a runtime running before T0 observes live pre-T0 bars: this lane holds 2 PRE_T0 + LIVE decisions, which contract section 4 classifies as a defect and validate_activation check 5 asserts absent. No record here is credited - every decision is PRE_T0 - and the whole lane is sealed so the cohort's L2 can be created fresh and started inside the lawful window [T0, T0 + one candle period). Two paper positions opened pre-T0 are sealed with it: wallet, position and database state are never carried between lanes.",
      "archived_utc": "2026-09-18T16:43:28Z",
      "verified_utc": "2026-09-18T16:43:39Z",
      "source_lane": "/home/hamza/projects/trading/trading_lab_os_final/freqtrade/user_data/fp-control-2",
      "file_count": 8,
      "total_bytes": 6444032,
      "files": {
        "evidence/.fp_capture.lock": "f97fdd362e957a76f26c3681d948135dceab35e6ddd92399aecdd72d529d5bb6",
        "evidence/capture_runtime.json": "9fce7dc97f118ebcc27d6bcc338b53ef41910d821bdb661bf26aef063bf4b857",
        "evidence/paper_decision_ledger.jsonl": "4145298cc8a0e176eeb72eeca02f1e9381bd29330a23d0ec50ac63f4480b3922",
        "evidence/paper_incident_ledger.jsonl": "dcc5411e002990ddac77d9c35fa349ef648cee751c244d19465ae02adcb6d305",
        "evidence/paper_input_ledger.jsonl": "6e360413c9f6d315cc285468d94d9286ed86fce4c7f55430039ee7ef8ae032b1",
        "evidence/paper_trade_ledger.jsonl": "8299ce325446ed38d1b2f60144122060ddc78d4238a44f0a776fc38a130b1051",
        "logs/freqtrade.log": "dfe693026394c55ab999ed76d30ee98ec36ccbf398c070d545630e6a5a7d5585",
        "tradesv3.sqlite": "a6ada6da679eeb83418ec97ca4a6a5b97e11c450202a77c6791301969d1429ab"
      },
      "evidence": {
        "present": true,
        "ledger_tips": {
          "decision": "ff3a17d9dfe1a8750c73e8259b90f2b5d29d9d839ba3a28ea3940124e0ba673f",
          "incident": "8e7024e414a0ac47a7e72587c28105502cd3d4e7e1d7ef198308c1eaa8b359b0",